Rank;Sourceid;Title;Type;Issn;SJR;SJR Best Quartile;H index;Total Docs. (2020);Total Docs. (3years);Total Refs.;Total Cites (3years);Citable Docs. (3years);Cites / Doc. (2years);Ref. / Doc.;Country;Region;Publisher;Coverage;Categories
1851;21100348975;"Studia Historica Slovenica";journal;"15808122";1,660;Q1;7;24;102;1014;74;102;0,95;42,25;Slovenia;Eastern Europe;"Historical Society Dr. Franca Kovacica in Maribor";"2002-2003, 2006-2019";"History (Q1); Social Sciences (miscellaneous) (Q1)"
1852;21100926541;"Information and Inference";journal;"20498772";1,659;Q1;26;27;53;991;284;53;5,11;36,70;United States;Northern America;"Oxford University Press";"2012-2020";"Analysis (Q1); Applied Mathematics (Q1); Computational Theory and Mathematics (Q1); Numerical Analysis (Q1); Statistics and Probability (Q1)"
1853;19700168304;"Journal of Advanced Research";journal;"20901232";1,659;Q1;55;162;222;8514;2177;215;10,10;52,56;Egypt;Africa/Middle East;"Cairo University";"2010-2020";"Multidisciplinary (Q1)"
1854;5400152621;"Sustainability Science";journal;"18624065, 18624057";1,659;Q1;54;127;310;9780;1761;279;5,55;77,01;Japan;Asiatic Region;"Springer Japan";"2006-2020";"Ecology (Q1); Geography, Planning and Development (Q1); Global and Planetary Change (Q1); Health (social science) (Q1); Management, Monitoring, Policy and Law (Q1); Nature and Landscape Conservation (Q1); Sociology and Political Science (Q1)"
1855;14987;"Developmental Medicine and Child Neurology";journal;"14698749, 00121622";1,658;Q1;143;337;856;7337;2368;462;2,78;21,77;United States;Northern America;"Wiley-Blackwell";"1958-2020";"Developmental Neuroscience (Q1); Neurology (clinical) (Q1); Pediatrics, Perinatology and Child Health (Q1)"
1856;9000153105;"Nonlinear Analysis: Hybrid Systems";journal;"1751570X";1,658;Q1;56;104;254;4185;1592;253;6,22;40,24;Netherlands;Western Europe;"Elsevier BV";"2007-2021";"Analysis (Q1); Computer Science Applications (Q1); Control and Systems Engineering (Q1)"
1857;24353;"Journal of Economic Surveys";journal;"14676419, 09500804";1,657;Q1;92;50;173;4701;761;173;4,29;94,02;United Kingdom;Western Europe;"Wiley-Blackwell Publishing Ltd";"1987-2020";"Economics and Econometrics (Q1)"
1858;21100942855;"Lancet Rheumatology, The";journal;"26659913";1,657;Q1;14;200;55;3435;144;28;2,62;17,18;United Kingdom;Western Europe;"Lancet Publishing Group";"2019-2020";"Immunology and Allergy (Q1); Rheumatology (Q1); Immunology (Q2)"
1859;13068;"Spine";journal;"03622436, 15281159";1,657;Q1;254;529;1486;7939;4648;1384;2,95;15,01;United States;Northern America;"Lippincott Williams and Wilkins Ltd.";"1976-2020";"Neurology (clinical) (Q1); Orthopedics and Sports Medicine (Q1); Sports Science (Q1)"
1860;17300154985;"Autism Research";journal;"19393792, 19393806";1,656;Q1;66;201;469;12390;2280;440;4,64;61,64;United States;Northern America;"John Wiley and Sons Inc.";"2008-2020";"Genetics (clinical) (Q1); Neurology (clinical) (Q1); Neuroscience (miscellaneous) (Q1)"
1861;19700175042;"Journal of Inflammation Research";journal;"11787031";1,656;Q1;33;109;98;6117;595;96;6,53;56,12;New Zealand;Pacific Region;"Dove Medical Press Ltd.";"2010-2020";"Immunology and Allergy (Q1); Immunology (Q2)"
1862;24790;"Journal of the European Academy of Dermatology and Venereology";journal;"09269959, 14683083";1,655;Q1;107;895;1971;19055;5257;890;2,57;21,29;United States;Northern America;"Wiley-Blackwell";"1991-2020";"Dermatology (Q1); Infectious Diseases (Q1)"
1863;4000151907;"Journal of the Royal Society Interface";journal;"17425689, 17425662";1,655;Q1;139;304;826;15720;4167;822;4,73;51,71;United Kingdom;Western Europe;"The Royal Society";"2004-2020";"Biochemistry (Q1); Bioengineering (Q1); Biomaterials (Q1); Biomedical Engineering (Q1); Biophysics (Q1); Biotechnology (Q1)"
1864;20021;"Nephrology Dialysis Transplantation";journal;"14602385, 09310509";1,654;Q1;168;298;934;10654;3667;888;3,79;35,75;United Kingdom;Western Europe;"Oxford University Press";"1986-2020";"Medicine (miscellaneous) (Q1); Nephrology (Q1); Transplantation (Q1)"
1865;15357;"Journal of Adolescent Health";journal;"1054139X, 18791972";1,653;Q1;161;381;888;10517;3294;725;3,26;27,60;United States;Northern America;"Elsevier USA";"1991-2020";"Pediatrics, Perinatology and Child Health (Q1); Psychiatry and Mental Health (Q1); Public Health, Environmental and Occupational Health (Q1)"
1866;12235;"Journal of Neurotrauma";journal;"15579042, 08977151";1,653;Q1;149;263;992;15927;4488;947;4,35;60,56;United States;Northern America;"Mary Ann Liebert Inc.";"1988-2020";"Neurology (clinical) (Q1)"
1867;17337;"IEEE Transactions on Antennas and Propagation";journal;"15582221, 0018926X";1,652;Q1;200;982;2583;28135;14591;2574;5,19;28,65;United States;Northern America;"Institute of Electrical and Electronics Engineers Inc.";"1963-2020";"Condensed Matter Physics (Q1); Electrical and Electronic Engineering (Q1)"
1868;20220;"Journal of Bacteriology";journal;"00219193, 10985530";1,652;Q1;246;277;846;16861;2693;813;3,17;60,87;United States;Northern America;"American Society for Microbiology";"1945-2020";"Microbiology (Q1); Molecular Biology (Q2)"
1869;21100286342;"Philosophical Topics";journal;"02762080, 2154154X";1,652;Q1;10;0;29;0;69;29;3,90;0,00;United States;Northern America;"The University of Arkansas Press";"2011-2018";"Philosophy (Q1)"
1870;33648;"Neurorehabilitation and Neural Repair";journal;"15459683";1,651;Q1;106;98;261;5147;1174;254;3,76;52,52;United States;Northern America;"SAGE Publications Inc.";"1987-2020";"Neurology (Q1); Neurology (clinical) (Q1); Rehabilitation (Q1)"
1871;19700175115;"Frontiers in Systems Neuroscience";journal;"16625137";1,650;Q1;75;101;240;8755;882;227;3,20;86,68;Switzerland;Western Europe;"Frontiers Media S.A.";"2007-2020";"Cognitive Neuroscience (Q1); Developmental Neuroscience (Q1); Neuroscience (miscellaneous) (Q1); Cellular and Molecular Neuroscience (Q2)"
1872;4000148706;"Clinical and Vaccine Immunology";journal;"1556679X, 15566811";1,649;Q1;77;0;105;0;431;101;0,00;0,00;United States;Northern America;"American Society for Microbiology";"2006-2017";"Clinical Biochemistry (Q1); Immunology and Allergy (Q1); Medicine (miscellaneous) (Q1); Microbiology (medical) (Q1); Immunology (Q2)"
1873;25290;"International Journal of Drug Policy";journal;"18734758, 09553959";1,649;Q1;79;322;715;16752;3372;634;4,34;52,02;Netherlands;Western Europe;"Elsevier";"1998-2020";"Health Policy (Q1); Medicine (miscellaneous) (Q1)"
1874;15645;"Journal of Health and Social Behavior";journal;"00221465, 21506000";1,649;Q1;127;37;118;2109;415;107;3,41;57,00;United States;Northern America;"American Sociological Association";"1967-2020";"Public Health, Environmental and Occupational Health (Q1); Social Psychology (Q1)"
1875;6600153204;"Brain Structure and Function";journal;"18632653, 18632661";1,648;Q1;95;178;756;13603;2688;752;3,18;76,42;Germany;Western Europe;"Springer Verlag";"2007-2020";"Anatomy (Q1); Histology (Q1); Neuroscience (miscellaneous) (Q1)"
1876;18471;"Cell Proliferation";journal;"09607722, 13652184";1,647;Q1;74;204;347;12282;2302;341;6,49;60,21;United Kingdom;Western Europe;"Wiley-Blackwell Publishing Ltd";"1968-1982, 1984-2020";"Medicine (miscellaneous) (Q1); Cell Biology (Q2)"
1877;17426;"DNA Research";journal;"17561663, 13402838";1,647;Q1;98;22;149;1329;658;149;4,23;60,41;United Kingdom;Western Europe;"Oxford University Press";"1994-2020";"Genetics (Q1); Medicine (miscellaneous) (Q1); Molecular Biology (Q2)"
1878;74502;"Financial Management";journal;"00463892";1,647;Q1;68;50;101;2284;265;100;2,37;45,68;United States;Northern America;"Wiley-Blackwell";"1996-2020";"Accounting (Q1); Economics and Econometrics (Q1); Finance (Q1)"
1879;4400151713;"International Journal of Biological Sciences";journal;"14492288";1,647;Q1;89;278;586;16979;3651;585;6,09;61,08;Australia;Pacific Region;"Ivyspring International Publisher";"2005-2020";"Applied Microbiology and Biotechnology (Q1); Developmental Biology (Q1); Ecology, Evolution, Behavior and Systematics (Q1); Cell Biology (Q2); Molecular Biology (Q2)"
1880;8000153138;"Computer Science Review";journal;"15740137";1,646;Q1;44;54;61;7789;891;61;12,49;144,24;Ireland;Western Europe;"Elsevier Ireland Ltd";"2007-2020";"Computer Science (miscellaneous) (Q1); Theoretical Computer Science (Q1)"
1881;12512;"Journal of Management in Engineering - ASCE";journal;"19435479, 0742597X";1,646;Q1;70;129;244;8935;1747;242;7,18;69,26;United States;Northern America;"American Society of Civil Engineers (ASCE)";"1985-2020";"Engineering (miscellaneous) (Q1); Industrial Relations (Q1); Management Science and Operations Research (Q1); Strategy and Management (Q1)"
1882;23882;"Journal of Molecular and Cellular Cardiology";journal;"00222828, 10958584";1,645;Q1;159;177;589;10098;2631;568;4,27;57,05;United States;Northern America;"Academic Press Inc.";"1970-2020";"Cardiology and Cardiovascular Medicine (Q1); Molecular Biology (Q2)"
1883;19700194105;"Sustainable Cities and Society";journal;"22106707";1,645;Q1;61;705;1286;43818;10974;1284;8,53;62,15;Netherlands;Western Europe;"Elsevier BV";"2011-2020";"Civil and Structural Engineering (Q1); Geography, Planning and Development (Q1); Renewable Energy, Sustainability and the Environment (Q1); Transportation (Q1)"
1884;23310;"American Journal of Physiology - Gastrointestinal and Liver Physiology";journal;"01931857, 15221547";1,644;Q1;169;172;437;10159;1811;427;3,71;59,06;United States;Northern America;"American Physiological Society";"1980-2020";"Gastroenterology (Q1); Hepatology (Q1); Physiology (Q1); Physiology (medical) (Q1)"
1885;19569;"Annals of Epidemiology";journal;"18732585, 10472797";1,644;Q2;122;118;396;4406;1286;361;3,00;37,34;United States;Northern America;"Elsevier Inc.";"1990-2020";"Epidemiology (Q2)"
1886;17625;"Journal of Proteome Research";journal;"15353893, 15353907";1,644;Q1;161;426;1210;23883;5219;1200;4,22;56,06;United States;Northern America;"American Chemical Society";"2002-2020";"Biochemistry (Q1); Chemistry (miscellaneous) (Q1)"
1887;21100901141;"Nano Convergence";journal;"21965404";1,644;Q1;25;40;114;3327;768;109;8,00;83,18;United Kingdom;Western Europe;"Springer Open";"2016-2020";"Engineering (miscellaneous) (Q1); Materials Science (miscellaneous) (Q1)"
1888;21100901949;"Nano Futures";journal;"23991984";1,644;Q1;13;25;73;2301;269;17;3,37;92,04;United Kingdom;Western Europe;"Institute of Physics Publishing";"2017-2020";"Atomic and Molecular Physics, and Optics (Q1); Bioengineering (Q1); Biomedical Engineering (Q1); Chemistry (miscellaneous) (Q1); Electrical and Electronic Engineering (Q1); Materials Science (miscellaneous) (Q1)"
1889;17470;"Structural Safety";journal;"01674730";1,644;Q1;93;72;169;3445;990;169;5,51;47,85;Netherlands;Western Europe;"Elsevier";"1982-2021";"Building and Construction (Q1); Civil and Structural Engineering (Q1); Safety, Risk, Reliability and Quality (Q1)"
1890;14567;"Technometrics";journal;"15372723, 00401706";1,644;Q1;82;70;129;2320;464;127;3,48;33,14;United Kingdom;Western Europe;"Taylor and Francis Ltd.";"1959-2020";"Applied Mathematics (Q1); Modeling and Simulation (Q1); Statistics and Probability (Q1)"
1891;20343;"Ecosystems";journal;"14329840, 14350629";1,643;Q1;148;170;357;11989;1471;356;3,78;70,52;United States;Northern America;"Springer New York";"1998-2020";"Ecology (Q1); Ecology, Evolution, Behavior and Systematics (Q1); Environmental Chemistry (Q1)"
1892;4700152304;"European Journal of Work and Organizational Psychology";journal;"1359432X";1,643;Q1;65;95;193;9086;891;190;3,72;95,64;United Kingdom;Western Europe;"Taylor and Francis Ltd.";"2005-2020";"Applied Psychology (Q1); Organizational Behavior and Human Resource Management (Q1)"
1893;28795;"GIScience and Remote Sensing";journal;"15481603";1,643;Q1;44;70;144;4564;941;142;6,39;65,20;United Kingdom;Western Europe;"Taylor and Francis Ltd.";"2004-2020";"Earth and Planetary Sciences (miscellaneous) (Q1)"
1894;21100466714;"International Journal of Educational Technology in Higher Education";journal;"23659440";1,642;Q1;29;55;133;3578;1003;128;6,44;65,05;Netherlands;Western Europe;"Springer Netherlands";"2016-2020";"Computer Science Applications (Q1); Education (Q1); E-learning (Q1)"
1895;29412;"Group and Organization Management";journal;"10596011";1,641;Q1;84;30;97;2860;360;87;3,63;95,33;United States;Northern America;"SAGE Publications Inc.";"1976-2020";"Applied Psychology (Q1); Arts and Humanities (miscellaneous) (Q1); Organizational Behavior and Human Resource Management (Q1)"
1896;19600157019;"IEEE Reviews in Biomedical Engineering";journal;"19373333, 19411189";1,641;Q1;46;31;66;3008;614;63;9,05;97,03;United States;Northern America;"Institute of Electrical and Electronics Engineers Inc.";"2008-2020";"Biomedical Engineering (Q1)"
1897;18446;"Cell and Tissue Research";journal;"14320878, 0302766X";1,640;Q1;137;190;588;12414;2600;575;4,57;65,34;Germany;Western Europe;"Springer Verlag";"1924-1943, 1945, 1948-2020";"Histology (Q1); Pathology and Forensic Medicine (Q1); Cell Biology (Q2)"
1898;16800154723;"Marketing Theory";journal;"14705931, 1741301X";1,640;Q1;65;36;89;2242;365;78;3,15;62,28;United Kingdom;Western Europe;"SAGE Publications Ltd";"2001-2020";"Marketing (Q1)"
1899;21100422918;"Bone and Joint Research";journal;"20463758";1,639;Q1;31;107;235;4540;1154;220;5,09;42,43;United Kingdom;Western Europe;"British Editorial Society of Bone and Joint Surgery";"2012-2020";"Orthopedics and Sports Medicine (Q1); Surgery (Q1)"
1900;25801;"Carbohydrate Polymers";journal;"18791344, 01448617";1,639;Q1;208;1448;3791;78352;33899;3787;9,15;54,11;United Kingdom;Western Europe;"Elsevier Ltd.";"1981-2021";"Materials Chemistry (Q1); Organic Chemistry (Q1); Polymers and Plastics (Q1)"
1901;21100199818;"Energy Strategy Reviews";journal;"2211467X";1,639;Q1;33;98;247;6273;1645;245;7,19;64,01;Netherlands;Western Europe;"Elsevier";"2012-2020";"Energy (miscellaneous) (Q1)"
1902;14635;"Ophthalmologica";journal;"00303755, 14230267";1,639;Q1;60;52;202;1497;620;185;2,99;28,79;Switzerland;Western Europe;"S. Karger AG";"1899-2020";"Medicine (miscellaneous) (Q1); Ophthalmology (Q1); Sensory Systems (Q1)"
1903;17391;"IEEE Transactions on Signal Processing";journal;"19410476, 1053587X";1,638;Q1;270;418;1352;18642;10818;1346;7,53;44,60;United States;Northern America;"Institute of Electrical and Electronics Engineers Inc.";"1991-2020";"Electrical and Electronic Engineering (Q1); Signal Processing (Q1)"
1904;25733;"Journal of Criminal Justice";journal;"00472352";1,638;Q1;80;59;189;4697;750;189;3,16;79,61;United Kingdom;Western Europe;"Elsevier BV";"1973-2020";"Applied Psychology (Q1); Law (Q1); Social Psychology (Q1); Sociology and Political Science (Q1)"
1905;21100202948;"Nous-Supplement: Philosophical Issues";journal;"15336077, 17582237";1,638;Q1;18;21;69;871;116;69;1,33;41,48;Germany;Western Europe;"Wiley-VCH Verlag";"2011-2020";"Philosophy (Q1)"
1906;26071;"Seminars in Hematology";journal;"00371963, 15328686";1,638;Q1;94;30;114;2371;429;102;3,28;79,03;United Kingdom;Western Europe;"W.B. Saunders Ltd";"1964-2020";"Hematology (Q1)"
1907;15700154704;"Oncology Reviews";journal;"19705557, 19705565";1,637;Q1;21;27;52;1972;295;51;3,52;73,04;Italy;Western Europe;"PagePress Publications";"2007-2020";"Oncology (Q1); Cancer Research (Q2)"
1908;21100240500;"Catalysis Science and Technology";journal;"20444761, 20444753";1,635;Q1;115;748;1815;47364;11310;1807;6,00;63,32;United Kingdom;Western Europe;"Royal Society of Chemistry";"2011-2020";"Catalysis (Q1)"
1909;21100886430;"Forum of Mathematics, Sigma";journal;"20505094";1,635;Q1;23;67;77;2482;266;77;2,56;37,04;United Kingdom;Western Europe;"Cambridge University Press";"2013-2020";"Algebra and Number Theory (Q1); Analysis (Q1); Computational Mathematics (Q1); Discrete Mathematics and Combinatorics (Q1); Geometry and Topology (Q1); Mathematical Physics (Q1); Statistics and Probability (Q1); Theoretical Computer Science (Q1)"
1910;27546;"International Journal of Geomechanics";journal;"15323641, 19435622";1,635;Q1;63;348;843;14727;3287;784;3,61;42,32;United States;Northern America;"American Society of Civil Engineers (ASCE)";"2001-2020";"Geotechnical Engineering and Engineering Geology (Q1); Soil Science (Q1)"
1911;22609;"Journal of Learning Disabilities";journal;"15384780, 00222194";1,635;Q1;91;53;149;3104;478;142;2,66;58,57;United States;Northern America;"SAGE Publications Inc.";"1973-2020";"Education (Q1); Health Professions (miscellaneous) (Q1); Health (social science) (Q1)"
1912;14538;"Developmental Dynamics";journal;"10588388, 10970177";1,634;Q1;141;120;284;8270;947;274;3,39;68,92;United States;Northern America;"Wiley-Liss Inc.";"1992-2020";"Developmental Biology (Q1)"
1913;13517;"Ultrasonics Sonochemistry";journal;"13504177, 18732828";1,634;Q1;128;439;1526;22166;11742;1518;7,35;50,49;Netherlands;Western Europe;"Elsevier";"1994-2021";"Acoustics and Ultrasonics (Q1); Chemical Engineering (miscellaneous) (Q1); Environmental Chemistry (Q1); Inorganic Chemistry (Q1); Organic Chemistry (Q1); Radiology, Nuclear Medicine and Imaging (Q1)"
1914;21100853949;"Biomarker Research";journal;"20507771";1,633;Q1;26;73;96;5114;613;92;5,43;70,05;United Kingdom;Western Europe;"BioMed Central Ltd.";"2013-2020";"Biochemistry (medical) (Q1); Clinical Biochemistry (Q1); Molecular Medicine (Q1)"
1915;22243;"Human Gene Therapy";journal;"10430342, 15577422";1,633;Q1;149;157;383;5962;1672;344;4,43;37,97;United States;Northern America;"Mary Ann Liebert Inc.";"1990-2020";"Genetics (Q1); Molecular Medicine (Q1); Molecular Biology (Q2)"
1916;24657;"Chemosphere";journal;"00456535";1,632;Q1;248;3039;6460;173496;46391;6428;7,04;57,09;United Kingdom;Western Europe;"Elsevier Ltd.";"1972-2021";"Chemistry (miscellaneous) (Q1); Environmental Chemistry (Q1); Environmental Engineering (Q1); Health, Toxicology and Mutagenesis (Q1); Medicine (miscellaneous) (Q1); Pollution (Q1); Public Health, Environmental and Occupational Health (Q1)"
1917;17785;"Medical Care";journal;"15371948, 00257079";1,632;Q1;178;181;616;5185;1634;540;2,18;28,65;United States;Northern America;"Lippincott Williams and Wilkins Ltd.";"1963-2020";"Public Health, Environmental and Occupational Health (Q1)"
1918;5700163398;"Swiss Political Science Review";journal;"14247755, 16626370";1,632;Q1;30;26;90;1759;288;66;1,46;67,65;United States;Northern America;"Wiley-Blackwell";"1995-2020";"Political Science and International Relations (Q1)"
1919;21100463801;"Annals of the American Association of Geographers";journal;"24694460, 24694452";1,631;Q1;116;213;331;15202;1503;321;4,53;71,37;United Kingdom;Western Europe;"Taylor and Francis Ltd.";"2016-2020";"Earth-Surface Processes (Q1); Geography, Planning and Development (Q1)"
1920;15063;"Composite Structures";journal;"02638223";1,630;Q1;157;1123;3645;47662;21527;3634;5,65;42,44;Netherlands;Western Europe;"Elsevier BV";"1983-2021";"Ceramics and Composites (Q1); Civil and Structural Engineering (Q1)"
1921;19400158516;"Food and Environmental Virology";journal;"18670334, 18670342";1,630;Q1;32;42;142;1807;428;141;2,87;43,02;United States;Northern America;"Springer New York";"2009-2020";"Food Science (Q1); Health, Toxicology and Mutagenesis (Q1); Epidemiology (Q2); Virology (Q2)"
1922;96592;"Journal of Agrarian Change";journal;"14710366, 14710358";1,630;Q1;56;32;125;2484;367;125;2,56;77,63;United Kingdom;Western Europe;"Wiley-Blackwell Publishing Ltd";"2001-2020";"Anthropology (Q1); Archeology (Q1); Archeology (arts and humanities) (Q1); Global and Planetary Change (Q1)"
1923;19600157309;"Journal of Hepato-Biliary-Pancreatic Sciences";journal;"18686982, 18686974";1,630;Q1;60;155;207;4020;904;180;4,73;25,94;United States;Northern America;"Wiley-Blackwell";"1994, 2010-2019";"Hepatology (Q1); Surgery (Q1)"
1924;16800154721;"Journal of Hospitality and Tourism Research";journal;"10963480, 15577554";1,630;Q1;70;109;167;7077;945;164;5,20;64,93;United States;Northern America;"SAGE Publications Inc.";"1976-1981, 1983-1985, 1987-2020";"Education (Q1); Tourism, Leisure and Hospitality Management (Q1)"
1925;14925;"Gender and Society";journal;"08912432, 15523977";1,629;Q1;103;38;98;1994;387;98;3,12;52,47;United States;Northern America;"SAGE Publications Inc.";"1987-2020";"Arts and Humanities (miscellaneous) (Q1); Gender Studies (Q1); Sociology and Political Science (Q1)"
1926;16088;"Journal of Nanobiotechnology";journal;"14773155";1,629;Q1;76;173;315;9891;2936;313;9,46;57,17;United Kingdom;Western Europe;"BioMed Central Ltd.";"2003-2020";"Applied Microbiology and Biotechnology (Q1); Bioengineering (Q1); Biomedical Engineering (Q1); Medicine (miscellaneous) (Q1); Molecular Medicine (Q1); Nanoscience and Nanotechnology (Q1); Pharmaceutical Science (Q1)"
1927;17665;"Preventive Medicine";journal;"10960260, 00917435";1,628;Q1;169;307;1042;12343;4091;971;3,45;40,21;United States;Northern America;"Academic Press Inc.";"1946, 1972-2020";"Public Health, Environmental and Occupational Health (Q1); Epidemiology (Q2)"
1928;29820;"Histopathology";journal;"13652559, 03090167";1,626;Q1;124;249;732;7689;2792;607;3,96;30,88;United Kingdom;Western Europe;"Wiley-Blackwell Publishing Ltd";"1977-2020";"Histology (Q1); Medicine (miscellaneous) (Q1); Pathology and Forensic Medicine (Q1)"
1929;21100884993;"Microsystems and Nanoengineering";journal;"20557434";1,625;Q1;30;114;145;5899;940;144;6,65;51,75;United Kingdom;Western Europe;"Nature Publishing Group";"2015-2020";"Atomic and Molecular Physics, and Optics (Q1); Condensed Matter Physics (Q1); Electrical and Electronic Engineering (Q1); Industrial and Manufacturing Engineering (Q1); Materials Science (miscellaneous) (Q1)"
1930;82360;"Journal of Nonlinear Science";journal;"09388974, 14321467";1,624;Q1;60;100;223;4438;946;219;4,98;44,38;United States;Northern America;"Springer New York";"1991-2020";"Applied Mathematics (Q1); Engineering (miscellaneous) (Q1); Modeling and Simulation (Q1)"
1931;39563;"International Journal of Applied Earth Observation and Geoinformation";journal;"15698432";1,623;Q1;98;16;523;1076;3348;520;6,62;67,25;Netherlands;Western Europe;"Elsevier";"1998-2020";"Computers in Earth Sciences (Q1); Earth-Surface Processes (Q1); Global and Planetary Change (Q1); Management, Monitoring, Policy and Law (Q1)"
1932;12628;"Oral Oncology";journal;"18790593, 13688375";1,623;Q1;115;454;900;13444;3682;727;3,79;29,61;United Kingdom;Western Europe;"Elsevier Ltd.";"1996-2020";"Oncology (Q1); Oral Surgery (Q1); Cancer Research (Q2)"
1933;21948;"Regional Anesthesia and Pain Medicine";journal;"10987339, 15328651";1,623;Q1;109;285;618;5223;1950;347;3,13;18,33;United States;Northern America;"Lippincott Williams and Wilkins Ltd.";"1998-2020";"Anesthesiology and Pain Medicine (Q1); Medicine (miscellaneous) (Q1)"
1934;20515;"Seminars in Nephrology";journal;"15584488, 02709295";1,623;Q1;86;62;179;4414;741;161;4,20;71,19;United Kingdom;Western Europe;"W.B. Saunders Ltd";"1981-2020";"Nephrology (Q1)"
1935;12551;"Best Practice and Research in Clinical Obstetrics and Gynaecology";journal;"15216934";1,622;Q1;84;109;275;6327;1397;251;4,95;58,05;United Kingdom;Western Europe;"Bailliere Tindall Ltd";"1999-2020";"Medicine (miscellaneous) (Q1); Obstetrics and Gynecology (Q1)"
1936;4700152305;"Public Management Review";journal;"14719037";1,622;Q1;68;158;258;12333;1429;243;5,39;78,06;United Kingdom;Western Europe;"Taylor and Francis Ltd.";"2001-2020";"Management Information Systems (Q1); Management of Technology and Innovation (Q1); Public Administration (Q1)"
1937;12344;"Scandinavian Journal of Work, Environment and Health";journal;"03553140, 1795990X";1,621;Q1;103;75;222;3128;915;192;4,01;41,71;Finland;Western Europe;"Finnish Institute of Occupational Health";"1975-2020";"Public Health, Environmental and Occupational Health (Q1)"
1938;147234;"Selecta Mathematica, New Series";journal;"10221824";1,621;Q1;49;80;268;2885;740;267;2,76;36,06;Switzerland;Western Europe;"Birkhauser Verlag Basel";"1995-2002, 2005-2020";"Mathematics (miscellaneous) (Q1); Physics and Astronomy (miscellaneous) (Q1)"
1939;19172;"Psychosomatic Medicine";journal;"00333174, 15347796";1,620;Q1;187;112;345;4517;1250;326;3,09;40,33;United States;Northern America;"Lippincott Williams and Wilkins Ltd.";"1945-2020";"Applied Psychology (Q1); Developmental and Educational Psychology (Q1); Psychiatry and Mental Health (Q1)"
1940;22140;"Mathematics of Operations Research";journal;"15265471, 0364765X";1,619;Q1;83;67;190;2312;783;190;3,83;34,51;United States;Northern America;"INFORMS Institute for Operations Research and the Management Sciences";"1976-1989, 1995-2020";"Computer Science Applications (Q1); Management Science and Operations Research (Q1); Mathematics (miscellaneous) (Q1)"
1941;4400151517;"Cell Communication and Signaling";journal;"1478811X";1,618;Q1;63;185;320;12697;1673;319;5,13;68,63;United Kingdom;Western Europe;"Signal Transduction Society";"2003-2020";"Biochemistry (Q1); Cell Biology (Q2); Molecular Biology (Q2)"
1942;11600154504;"Current Protocols in Immunology";journal;"19343671, 1934368X";1,618;Q1;43;24;65;969;181;63;2,91;40,38;United States;Northern America;"John Wiley and Sons Inc.";"2001-2020";"Medicine (miscellaneous) (Q1); Immunology (Q2)"
1943;15904;"Geosynthetics International";journal;"10726349, 17517613";1,618;Q1;52;52;137;2323;495;135;3,59;44,67;United Kingdom;Western Europe;"ICE Publishing";"1994-2020";"Geotechnical Engineering and Engineering Geology (Q1)"
1944;30088;"Journal of Social Issues";journal;"00224537, 15404560";1,618;Q1;122;47;145;3193;615;144;3,19;67,94;United Kingdom;Western Europe;"Wiley-Blackwell Publishing Ltd";"1945-2020";"Social Sciences (miscellaneous) (Q1)"
1945;11200153565;"Pigment Cell and Melanoma Research";journal;"1755148X, 17551471";1,618;Q1;105;97;225;4643;685;163;3,26;47,87;United Kingdom;Western Europe;"Wiley-Blackwell Publishing Ltd";"2008-2020";"Biochemistry, Genetics and Molecular Biology (miscellaneous) (Q1); Dermatology (Q1); Oncology (Q1)"
