Rank;Sourceid;Title;Type;Issn;SJR;SJR Best Quartile;H index;Total Docs. (2020);Total Docs. (3years);Total Refs.;Total Cites (3years);Citable Docs. (3years);Cites / Doc. (2years);Ref. / Doc.;Country;Region;Publisher;Coverage;Categories
1167;23406;"Business Strategy and the Environment";journal;"10990836, 09644733";2,123;Q1;105;252;326;20680;3418;323;8,99;82,06;United Kingdom;Western Europe;"John Wiley and Sons Ltd";"1992-2020";"Business and International Management (Q1); Geography, Planning and Development (Q1); Management, Monitoring, Policy and Law (Q1); Strategy and Management (Q1)"
1168;23212;"Annales de l'institut Henri Poincare (B) Probability and Statistics";journal;"02460203";2,121;Q1;53;113;247;3631;710;247;3,16;32,13;Netherlands;Western Europe;"Institute of Mathematical Statistics";"1997-2020";"Statistics and Probability (Q1); Statistics, Probability and Uncertainty (Q1)"
1169;14735;"Government Information Quarterly";journal;"0740624X";2,121;Q1;103;76;205;5894;1946;193;8,39;77,55;United Kingdom;Western Europe;"Elsevier Ltd.";"1984-2020";"E-learning (Q1); Law (Q1); Library and Information Sciences (Q1); Sociology and Political Science (Q1)"
1170;13093;"Quarterly Review of Biology";journal;"15397718, 00335770";2,121;Q1;75;7;23;1277;132;23;4,40;182,43;United States;Northern America;"University of Chicago";"1945-2020";"Agricultural and Biological Sciences (miscellaneous) (Q1)"
1171;21100437623;"Burnout Research";journal;"22130586";2,120;Q1;24;0;18;0;176;14;0,00;0,00;Netherlands;Western Europe;"Elsevier BV";"2014-2017";"Psychiatry and Mental Health (Q1); Public Health, Environmental and Occupational Health (Q1)"
1172;21100866005;"Cancer Communications";journal;"25233548";2,119;Q1;53;75;211;2866;1359;171;7,13;38,21;United Kingdom;Western Europe;"BioMed Central Ltd.";"2017-2020";"Cancer Research (Q1); Oncology (Q1)"
1173;23181;"Europace";journal;"10995129, 15322092";2,119;Q1;102;326;1205;6773;3953;879;3,25;20,78;United Kingdom;Western Europe;"Oxford University Press";"1999-2020";"Cardiology and Cardiovascular Medicine (Q1); Physiology (medical) (Q1)"
1174;23010;"Journal of Controlled Release";journal;"18734995, 01683659";2,119;Q1;269;542;1475;46989;12990;1397;8,66;86,70;Netherlands;Western Europe;"Elsevier";"1984-2020";"Pharmaceutical Science (Q1)"
1175;23915;"Analytical Chemistry";journal;"15206882, 00032700";2,117;Q1;332;2041;5770;91418;39161;5717;6,66;44,79;United States;Northern America;"American Chemical Society";"1947-2020";"Analytical Chemistry (Q1)"
1176;17191;"International Journal of Radiation Oncology Biology Physics";journal;"03603016, 1879355X";2,117;Q1;248;584;1807;14085;6588;1167;3,48;24,12;United States;Northern America;"Elsevier Inc.";"1975-2020";"Cancer Research (Q1); Oncology (Q1); Radiation (Q1); Radiology, Nuclear Medicine and Imaging (Q1)"
1177;21100898934;"BMJ Global Health";journal;"20597908";2,111;Q1;32;464;752;19753;3395;655;4,30;42,57;United Kingdom;Western Europe;"BMJ Publishing Group";"2016-2020";"Health Policy (Q1); Public Health, Environmental and Occupational Health (Q1)"
1178;15440;"Dialogues in Clinical Neuroscience";journal;"19585969, 12948322";2,110;Q1;87;31;119;1870;776;113;5,00;60,32;France;Western Europe;"Servier International";"2002-2020";"Biological Psychiatry (Q1); Psychiatry and Mental Health (Q1)"
1179;12841;"Clinical Child and Family Psychology Review";journal;"15732827, 10964037";2,109;Q1;101;29;81;3090;459;78;5,20;106,55;United States;Northern America;"Kluwer Academic Publishers";"1998-2020";"Clinical Psychology (Q1); Developmental and Educational Psychology (Q1); Education (Q1); Pediatrics, Perinatology and Child Health (Q1); Psychiatry and Mental Health (Q1)"
1180;19419;"Computers in Human Behavior";journal;"07475632";2,108;Q1;178;385;1597;26867;14501;1573;7,83;69,78;United Kingdom;Western Europe;"Elsevier Ltd.";"1985-2021";"Arts and Humanities (miscellaneous) (Q1); Human-Computer Interaction (Q1); Psychology (miscellaneous) (Q1)"
1181;144981;"Quantitative Marketing and Economics";journal;"15707156, 1573711X";2,108;Q1;33;13;36;520;51;36;1,42;40,00;Netherlands;Western Europe;"Kluwer Academic Publishers";"2005-2020";"Economics, Econometrics and Finance (miscellaneous) (Q1); Marketing (Q1)"
1182;30047;"Journal of Positive Behavior Interventions";journal;"10983007, 15384772";2,107;Q1;61;32;64;1412;245;61;3,34;44,13;United States;Northern America;"SAGE Publications Inc.";"1999-2020";"Applied Psychology (Q1); Developmental and Educational Psychology (Q1); Pediatrics, Perinatology and Child Health (Q1)"
1183;40981;"Biology and Fertility of Soils";journal;"14320789, 01782762";2,106;Q1;124;95;233;6165;1421;228;5,85;64,89;Germany;Western Europe;"Springer Verlag";"1985-2020";"Agronomy and Crop Science (Q1); Microbiology (Q1); Soil Science (Q1)"
1184;27467;"Gynecologic Oncology";journal;"00908258, 10956859";2,105;Q1;162;480;1150;15477;5359;1087;4,41;32,24;United States;Northern America;"Academic Press Inc.";"1972-2020";"Obstetrics and Gynecology (Q1); Oncology (Q1)"
1185;21100920679;"Global Sustainability";journal;"20594798";2,101;Q1;10;39;27;2650;177;26;6,56;67,95;United Kingdom;Western Europe;"Cambridge University Press";"2018-2020";"Global and Planetary Change (Q1); Management, Monitoring, Policy and Law (Q1)"
1186;26365;"Demography";journal;"00703370, 15337790";2,099;Q1;129;96;298;5970;1180;295;3,67;62,19;United States;Northern America;"Springer New York";"1964-2020";"Demography (Q1)"
1187;21100843667;"Frontiers in Molecular Biosciences";journal;"2296889X";2,098;Q1;37;420;348;30884;1774;330;4,62;73,53;Switzerland;Western Europe;"Frontiers Media S.A.";"2014-2020";"Biochemistry (Q1); Biochemistry, Genetics and Molecular Biology (miscellaneous) (Q1); Molecular Biology (Q1)"
1188;21100862881;"Quantum Science and Technology";journal;"20589565";2,095;Q1;40;93;265;4972;2276;263;9,86;53,46;United States;Northern America;"Institute of Physics Publishing";"2016-2020";"Atomic and Molecular Physics, and Optics (Q1); Electrical and Electronic Engineering (Q1); Materials Science (miscellaneous) (Q1); Physics and Astronomy (miscellaneous) (Q1)"
1189;21100879732;"APL Photonics";journal;"23780967";2,094;Q1;34;146;327;6606;2142;316;6,74;45,25;United States;Northern America;"AIP Publishing LLC";"2016-2020";"Atomic and Molecular Physics, and Optics (Q1); Computer Networks and Communications (Q1)"
1190;29403;"Energy Policy";journal;"03014215";2,093;Q1;217;679;2165;40582;14111;2135;6,29;59,77;United Kingdom;Western Europe;"Elsevier BV";"1973-2020";"Energy (miscellaneous) (Q1); Management, Monitoring, Policy and Law (Q1)"
1191;29482;"Physics Letters, Section B: Nuclear, Elementary Particle and High-Energy Physics";journal;"03702693";2,093;Q1;283;821;2615;39282;20450;2611;8,61;47,85;Netherlands;Western Europe;"Elsevier";"1967-2020";"Nuclear and High Energy Physics (Q1)"
1192;35048;"Food Policy";journal;"03069192";2,092;Q1;102;118;337;6576;1852;333;4,54;55,73;United Kingdom;Western Europe;"Elsevier BV";"1975-2020";"Development (Q1); Economics and Econometrics (Q1); Food Science (Q1); Management, Monitoring, Policy and Law (Q1); Sociology and Political Science (Q1)"
1193;23894;"Journal of Functional Analysis";journal;"10960783, 00221236";2,091;Q1;108;278;682;9126;2167;682;2,90;32,83;United States;Northern America;"Academic Press Inc.";"1967-2020";"Analysis (Q1)"
1194;9500153997;"Polymer Reviews";journal;"15583724, 15583716";2,089;Q1;90;29;65;4869;688;65;12,08;167,90;United States;Northern America;"Taylor and Francis Ltd.";"2006-2020";"Biomedical Engineering (Q1); Chemistry (miscellaneous) (Q1); Electrical and Electronic Engineering (Q1); Electronic, Optical and Magnetic Materials (Q1); Materials Chemistry (Q1); Polymers and Plastics (Q1); Renewable Energy, Sustainability and the Environment (Q1)"
1195;14723;"Urban Education";journal;"00420859, 15528340";2,089;Q1;56;130;229;9018;675;185;2,59;69,37;United States;Northern America;"SAGE Publications Inc.";"1965-2020";"Education (Q1); Urban Studies (Q1)"
1196;25812;"Communications in Partial Differential Equations";journal;"03605302, 15324133";2,087;Q1;87;74;181;2229;612;181;3,33;30,12;United States;Northern America;"Taylor and Francis Ltd.";"1971, 1976-2020";"Analysis (Q1); Applied Mathematics (Q1)"
1197;19700188389;"Wiley Interdisciplinary Reviews: Systems Biology and Medicine";journal;"1939005X, 19395094";2,087;Q1;51;43;73;6551;391;70;5,11;152,35;United States;Northern America;"John Wiley and Sons Inc.";"2009-2020";"Biochemistry, Genetics and Molecular Biology (miscellaneous) (Q1); Medicine (miscellaneous) (Q1)"
1198;29309;"Critical Reviews in Oncology/Hematology";journal;"10408428";2,084;Q1;122;188;542;15644;3437;539;5,69;83,21;Ireland;Western Europe;"Elsevier Ireland Ltd";"1983-2020";"Geriatrics and Gerontology (Q1); Hematology (Q1); Oncology (Q1)"
1199;12028;"Applied Psychological Measurement";journal;"01466216, 15523497";2,083;Q1;64;40;132;1208;334;128;1,92;30,20;United States;Northern America;"SAGE Publications Inc.";"1977-2020";"Psychology (miscellaneous) (Q1); Social Sciences (miscellaneous) (Q1)"
1200;30022;"Journal of Personality";journal;"00223506, 14676494";2,082;Q1;144;109;226;7940;974;225;4,45;72,84;United Kingdom;Western Europe;"Wiley-Blackwell Publishing Ltd";"1932-2020";"Social Psychology (Q1)"
1201;23985;"Neurobiology of Aging";journal;"01974580, 15581497";2,081;Q1;186;278;945;15335;4442;931;4,36;55,16;United States;Northern America;"Elsevier Inc.";"1980-2020";"Aging (Q1); Developmental Biology (Q1); Geriatrics and Gerontology (Q1); Neurology (clinical) (Q1); Neuroscience (miscellaneous) (Q1)"
1202;16950;"Chromosome Research";journal;"15736849, 09673849";2,080;Q1;81;27;76;2013;310;73;4,48;74,56;Netherlands;Western Europe;"Springer Netherlands";"1993-2020";"Genetics (Q1)"
1203;12857;"Cognition";journal;"18737838, 00100277";2,080;Q1;187;318;711;20658;2744;700;3,55;64,96;Netherlands;Western Europe;"Elsevier";"1972-1974, 1976-2020";"Cognitive Neuroscience (Q1); Developmental and Educational Psychology (Q1); Experimental and Cognitive Psychology (Q1); Language and Linguistics (Q1); Linguistics and Language (Q1)"
1204;14129;"Methods";journal;"10462023, 10959130";2,080;Q1;150;219;676;12913;2617;627;3,16;58,96;United States;Northern America;"Academic Press Inc.";"1990-2020";"Biochemistry, Genetics and Molecular Biology (miscellaneous) (Q1); Molecular Biology (Q1)"
1205;23038;"ACM Computing Surveys";journal;"03600300, 15577341";2,079;Q1;163;112;365;15859;6978;365;19,16;141,60;United States;Northern America;"Association for Computing Machinery (ACM)";"1969-2020";"Computer Science (miscellaneous) (Q1); Theoretical Computer Science (Q1)"
1206;144742;"International Journal of Contemporary Hospitality Management";journal;"09596119";2,079;Q1;86;191;580;14757;4462;574;6,52;77,26;United Kingdom;Western Europe;"Emerald Group Publishing Ltd.";"1989-2020";"Tourism, Leisure and Hospitality Management (Q1)"
1207;25252;"Contributions to Mineralogy and Petrology";journal;"00107999, 14320967";2,078;Q1;150;112;304;8710;1163;302;3,76;77,77;Germany;Western Europe;"Springer Verlag";"1966-2020";"Geochemistry and Petrology (Q1); Geophysics (Q1)"
1208;19200156952;"Journal of Innate Immunity";journal;"16628128, 1662811X";2,078;Q1;64;43;146;2614;791;130;5,76;60,79;Switzerland;Western Europe;"S. Karger AG";"2008-2020";"Immunology and Allergy (Q1)"
1209;19700168103;"mAbs";journal;"19420870, 19420862";2,078;Q1;78;115;344;5449;1844;338;5,47;47,38;United States;Northern America;"Landes Bioscience";"2009-2020";"Immunology (Q1); Immunology and Allergy (Q1)"
1210;21100338350;"IEEE Internet of Things Journal";journal;"23274662";2,075;Q1;97;1163;1594;40380;20461;1555;12,37;34,72;United States;Northern America;"Institute of Electrical and Electronics Engineers Inc.";"2014-2020";"Computer Networks and Communications (Q1); Computer Science Applications (Q1); Hardware and Architecture (Q1); Information Systems (Q1); Information Systems and Management (Q1); Signal Processing (Q1)"
1211;28552;"International Small Business Journal";journal;"02662426";2,075;Q1;85;53;124;4497;785;124;5,69;84,85;United Kingdom;Western Europe;"SAGE Publications Ltd";"1982-2020";"Business and International Management (Q1)"
1212;19615;"Antimicrobial Agents and Chemotherapy";journal;"10986596, 00664804";2,070;Q1;259;747;2639;26789;12822;2505;4,45;35,86;United States;Northern America;"American Society for Microbiology";"1963-1970, 1972-2020";"Infectious Diseases (Q1); Pharmacology (Q1); Pharmacology (medical) (Q1)"
1213;21100325079;"Current Opinion in Insect Science";journal;"22145745, 22145753";2,068;Q1;41;98;347;5510;1636;310;4,46;56,22;Netherlands;Western Europe;"Elsevier BV";"2014-2021";"Ecology, Evolution, Behavior and Systematics (Q1); Insect Science (Q1)"
1214;19700188421;"Monthly Notices of the Royal Astronomical Society: Letters";journal;"17453925, 17453933";2,067;Q1;122;229;610;9866;5035;610;8,94;43,08;United Kingdom;Western Europe;"Oxford University Press";"2005-2020";"Astronomy and Astrophysics (Q1); Space and Planetary Science (Q1)"
1215;21100407174;"Photonics Research";journal;"23279125";2,066;Q1;56;259;559;11894;4056;555;7,56;45,92;United States;Northern America;"OSA Publishing";"2013-2020";"Atomic and Molecular Physics, and Optics (Q1); Electronic, Optical and Magnetic Materials (Q1)"
1216;26422;"SIAM Journal on Optimization";journal;"10526234, 10957189";2,066;Q1;136;124;348;5037;2106;348;5,32;40,62;United States;Northern America;"Society for Industrial and Applied Mathematics Publications";"1991, 1996-2020";"Software (Q1); Theoretical Computer Science (Q1)"
1217;23460;"Journal of General Physiology";journal;"00221295, 15407748";2,064;Q1;127;94;369;3818;1061;281;2,70;40,62;United States;Northern America;"Rockefeller University Press";"1919, 1933, 1936, 1945-2020";"Physiology (Q1)"
1218;24738;"Lab on a Chip";journal;"14730197, 14730189";2,064;Q1;210;455;1170;21774;8268;1151;6,21;47,85;United Kingdom;Western Europe;"Royal Society of Chemistry";"2001-2020";"Biochemistry (Q1); Bioengineering (Q1); Biomedical Engineering (Q1); Chemistry (miscellaneous) (Q1); Nanoscience and Nanotechnology (Q1)"
1219;20356;"Reviews in Medical Virology";journal;"10529276, 10991654";2,060;Q1;90;91;140;7264;758;120;5,68;79,82;United Kingdom;Western Europe;"John Wiley and Sons Ltd";"1991-2020";"Infectious Diseases (Q1); Virology (Q1)"
1220;21100242403;"Redox Biology";journal;"22132317";2,059;Q1;88;434;783;33975;8400;770;10,47;78,28;Netherlands;Western Europe;"Elsevier BV";"2013-2020";"Biochemistry (Q1); Clinical Biochemistry (Q1); Organic Chemistry (Q1)"
1221;12996;"IEEE Signal Processing Magazine";journal;"10535888";2,058;Q1;188;98;283;2806;3887;238;11,64;28,63;United States;Northern America;"Institute of Electrical and Electronics Engineers Inc.";"1991-2020";"Applied Mathematics (Q1); Electrical and Electronic Engineering (Q1); Music (Q1); Signal Processing (Q1)"
1222;28218;"Monthly Notices of the Royal Astronomical Society";journal;"13652966, 00358711";2,058;Q1;383;3653;10488;273464;99701;10487;9,67;74,86;United Kingdom;Western Europe;"Oxford University Press";"1986-2020";"Astronomy and Astrophysics (Q1); Space and Planetary Science (Q1)"
1223;21100824897;"ACS Sensors";journal;"23793694";2,055;Q1;57;485;1019;23654;7635;983;7,01;48,77;United States;Northern America;"American Chemical Society";"2016-2020";"Bioengineering (Q1); Fluid Flow and Transfer Processes (Q1); Instrumentation (Q1); Process Chemistry and Technology (Q1)"
1224;21100218523;"Ecosystem Services";journal;"22120416";2,053;Q1;69;165;539;11890;3661;503;5,49;72,06;Netherlands;Western Europe;"Elsevier BV";"2012-2020";"Agricultural and Biological Sciences (miscellaneous) (Q1); Ecology (Q1); Geography, Planning and Development (Q1); Global and Planetary Change (Q1); Management, Monitoring, Policy and Law (Q1); Nature and Landscape Conservation (Q1)"
1225;19617;"Antiviral Research";journal;"01663542, 18729096";2,052;Q1;124;212;683;10684;4045;683;5,87;50,40;Netherlands;Western Europe;"Elsevier";"1959, 1981-2020";"Pharmacology (Q1); Virology (Q1)"
1226;4700152794;"Foundations and Trends in Networking";journal;"15540588, 1554057X";2,050;Q1;19;0;4;0;129;4;0,00;0,00;United States;Northern America;"Now Publishers Inc";"2006-2018";"Computer Networks and Communications (Q1)"
1227;20550;"Journal of Business Research";journal;"01482963";2,049;Q1;195;878;1342;73221;11507;1315;7,38;83,40;United States;Northern America;"Elsevier Inc.";"1973-2021";"Marketing (Q1)"
1228;25294;"Journal of Cystic Fibrosis";journal;"15691993, 18735010";2,049;Q1;77;241;469;6865;1754;375;3,75;28,49;Netherlands;Western Europe;"Elsevier";"2002-2020";"Pediatrics, Perinatology and Child Health (Q1); Pulmonary and Respiratory Medicine (Q1)"
1229;21503;"Evolution and Human Behavior";journal;"10905138";2,048;Q1;114;71;226;5788;877;216;3,75;81,52;United States;Northern America;"Elsevier Inc.";"1997-2020";"Arts and Humanities (miscellaneous) (Q1); Ecology, Evolution, Behavior and Systematics (Q1); Experimental and Cognitive Psychology (Q1)"
1230;27524;"International Journal of Coal Geology";journal;"01665162";2,048;Q1;136;178;520;14573;3772;516;6,81;81,87;Netherlands;Western Europe;"Elsevier";"1980-2020";"Economic Geology (Q1); Fuel Technology (Q1); Geology (Q1); Stratigraphy (Q1)"
1231;19700177557;"Mobile DNA";journal;"17598753";2,047;Q1;33;31;107;2084;393;107;3,84;67,23;United Kingdom;Western Europe;"BioMed Central Ltd.";"2010-2020";"Molecular Biology (Q1)"
1232;29170;"Critical Perspectives on Accounting";journal;"10452354, 10959955";2,042;Q1;67;74;131;6901;578;124;3,50;93,26;United States;Northern America;"Academic Press Inc.";"1990-2020";"Accounting (Q1); Finance (Q1); Information Systems and Management (Q1); Sociology and Political Science (Q1)"
1233;18504;"Current Topics in Membranes";journal;"10635823";2,042;Q1;40;21;68;2637;196;24;2,88;125,57;United States;Northern America;"Academic Press Inc.";"1991, 1994, 2000-2003, 2005-2020";"Cell Biology (Q1); Molecular Biology (Q1)"
1234;21100787106;"Journal of Industrial Information Integration";journal;"2452414X";2,042;Q1;24;28;86;2152;1361;83;12,26;76,86;Netherlands;Western Europe;"Elsevier BV";"2016-2020";"Industrial and Manufacturing Engineering (Q1); Information Systems and Management (Q1)"
1235;20909;"Transportation Research, Part E: Logistics and Transportation Review";journal;"13665545";2,042;Q1;110;233;507;13126;4018;499;7,63;56,33;United Kingdom;Western Europe;"Elsevier Ltd.";"1997-2020";"Business and International Management (Q1); Civil and Structural Engineering (Q1); Management Science and Operations Research (Q1); Transportation (Q1)"
1236;24613;"Contraception";journal;"00107824";2,040;Q1;102;162;503;3573;1387;440;2,69;22,06;United States;Northern America;"Elsevier USA";"1970-2020";"Obstetrics and Gynecology (Q1); Reproductive Medicine (Q1)"
1237;19700173215;"Nanoscale";journal;"20403372, 20403364";2,038;Q1;224;2459;7155;136561;51894;7147;7,12;55,54;United Kingdom;Western Europe;"Royal Society of Chemistry";"2009-2020";"Materials Science (miscellaneous) (Q1); Nanoscience and Nanotechnology (Q1)"
1238;18988;"Mutation Research - Reviews in Mutation Research";journal;"13882139, 13835742";2,037;Q1;125;29;106;4390;727;104;5,49;151,38;Netherlands;Western Europe;"Elsevier";"1990-1995, 1997-2020";"Genetics (Q1); Health, Toxicology and Mutagenesis (Q1)"
1239;19700175165;"Frontiers in Neural Circuits";journal;"16625110";2,036;Q1;61;89;314;6614;1175;302;3,48;74,31;Switzerland;Western Europe;"Frontiers Media S.A.";"2007-2020";"Cellular and Molecular Neuroscience (Q1); Cognitive Neuroscience (Q1); Neuroscience (miscellaneous) (Q1); Sensory Systems (Q1)"
1240;15406;"Journal of Clinical Child and Adolescent Psychology";journal;"15374424, 15374416";2,036;Q1;133;120;306;7696;1424;304;4,31;64,13;United States;Northern America;"Routledge";"1999-2020";"Clinical Psychology (Q1); Developmental and Educational Psychology (Q1)"
1241;26173;"Journal of Periodontology";journal;"00223492, 19433670";2,036;Q1;156;270;501;9767;2824;469;6,24;36,17;United States;Northern America;"John Wiley &amp; Sons Inc.";"1945-1951, 1965-2020";"Periodontics (Q1)"
1242;23644;"Supply Chain Management";journal;"13598546";2,036;Q1;115;60;131;5954;1183;129;8,93;99,23;United Kingdom;Western Europe;"Emerald Group Publishing Ltd.";"1996-2020";"Business, Management and Accounting (miscellaneous) (Q1); Strategy and Management (Q1)"
1243;21100241659;"Annals of the American Thoracic Society";journal;"23256621";2,035;Q1;114;289;1091;7926;3364;730;2,75;27,43;United States;Northern America;"American Thoracic Society";"2013-2020";"Pulmonary and Respiratory Medicine (Q1)"
1244;29187;"Cancer Science";journal;"13497006, 13479032";2,035;Q1;141;436;1036;17616;6322;1032;6,00;40,40;United States;Northern America;"Wiley-Blackwell";"2003-2020";"Cancer Research (Q1); Medicine (miscellaneous) (Q1); Oncology (Q1)"
1245;12229;"Mass Spectrometry Reviews";journal;"10982787, 02777037";2,035;Q1;126;74;91;10971;820;87;9,72;148,26;United States;Northern America;"John Wiley and Sons Inc.";"1982-2020";"Analytical Chemistry (Q1); Biochemistry, Genetics and Molecular Biology (miscellaneous) (Q1); Condensed Matter Physics (Q1); Spectroscopy (Q1)"
1246;25858;"Journal of Hazardous Materials";journal;"03043894";2,034;Q1;284;2143;2994;126809;31399;2975;10,39;59,17;Netherlands;Western Europe;"Elsevier";"1975-2021";"Environmental Chemistry (Q1); Environmental Engineering (Q1); Health, Toxicology and Mutagenesis (Q1); Pollution (Q1); Waste Management and Disposal (Q1)"
1247;22944;"Journal of International Marketing";journal;"15477215, 1069031X";2,034;Q1;89;22;57;1648;381;56;6,51;74,91;United States;Northern America;"American Marketing Association";"1996-2020";"Business and International Management (Q1); Economics and Econometrics (Q1); Marketing (Q1)"
1248;19143;"Arthritis Care and Research";journal;"2151464X, 21514658";2,032;Q1;163;273;733;12244;2945;654;3,72;44,85;United States;Northern America;"John Wiley and Sons Inc.";"1988-2020";"Rheumatology (Q1)"
1249;22030;"Canadian Geotechnical Journal";journal;"12086010, 00083674";2,032;Q1;118;154;468;6962;1845;395;3,45;45,21;Canada;Northern America;"National Research Council of Canada";"1968-1971, 1974, 1976-2020";"Civil and Structural Engineering (Q1); Geotechnical Engineering and Engineering Geology (Q1)"
1250;16281;"Journal of Geotechnical and Geoenvironmental Engineering - ASCE";journal;"10900241";2,032;Q1;154;224;598;9671;2116;504;3,66;43,17;United States;Northern America;"American Society of Civil Engineers (ASCE)";"1996-2020";"Environmental Science (miscellaneous) (Q1); Geotechnical Engineering and Engineering Geology (Q1)"
1251;21955;"Critical Reviews in Food Science and Nutrition";journal;"15497852, 10408398";2,030;Q1;155;574;747;77309;8084;745;9,98;134,68;United Kingdom;Western Europe;"Taylor and Francis Ltd.";"1980-2020";"Food Science (Q1); Industrial and Manufacturing Engineering (Q1); Medicine (miscellaneous) (Q1)"
1252;19400158343;"Current Opinion in Environmental Sustainability";journal;"18773435";2,029;Q1;87;89;301;4890;2032;282;6,00;54,94;Netherlands;Western Europe;"Elsevier";"2009-2021";"Environmental Science (miscellaneous) (Q1); Social Sciences (miscellaneous) (Q1)"
1253;4400151418;"Climate of the Past";journal;"18149332, 18149324";2,028;Q1;76;134;331;11896;1419;331;4,14;88,78;Germany;Western Europe;"European Geosciences Union";"2005-2020";"Global and Planetary Change (Q1); Paleontology (Q1); Stratigraphy (Q1)"
1254;95101;"IEEE Transactions on Robotics";journal;"15523098";2,027;Q1;159;144;351;5409;4344;349;9,72;37,56;United States;Northern America;"Institute of Electrical and Electronics Engineers Inc.";"1992, 2004-2020";"Computer Science Applications (Q1); Control and Systems Engineering (Q1); Electrical and Electronic Engineering (Q1)"
1255;28379;"Scripta Materialia";journal;"13596462";2,027;Q1;195;615;1597;21249;9464;1574;5,76;34,55;United Kingdom;Western Europe;"Elsevier Ltd.";"1996-2021";"Condensed Matter Physics (Q1); Materials Science (miscellaneous) (Q1); Mechanical Engineering (Q1); Mechanics of Materials (Q1); Metals and Alloys (Q1); Nanoscience and Nanotechnology (Q1)"
1256;19251;"Work, Employment and Society";journal;"09500170";2,027;Q1;79;104;181;5449;825;179;4,57;52,39;United Kingdom;Western Europe;"SAGE Publications Ltd";"1987-2020";"Accounting (Q1); Economics and Econometrics (Q1); Organizational Behavior and Human Resource Management (Q1); Sociology and Political Science (Q1)"
1257;12172;"Climate Dynamics";journal;"14320894, 09307575";2,026;Q1;163;494;1842;31948;7531;1835;3,98;64,67;Germany;Western Europe;"Springer Verlag";"1986-2020";"Atmospheric Science (Q1)"
1258;24246;"American Journal of Clinical Dermatology";journal;"11750561";2,023;Q1;89;82;234;5482;1371;217;5,94;66,85;United Kingdom;Western Europe;"Adis International Ltd";"2000-2020";"Dermatology (Q1); Medicine (miscellaneous) (Q1)"
1259;17300154924;"Epidemics";journal;"17554365, 18780067";2,023;Q1;41;48;141;2223;786;138;5,93;46,31;Netherlands;Western Europe;"Elsevier";"2009-2020";"Epidemiology (Q1); Infectious Diseases (Q1); Microbiology (Q1); Parasitology (Q1); Public Health, Environmental and Occupational Health (Q1); Virology (Q1)"
1260;21239;"Drugs";journal;"00126667, 11791950";2,022;Q1;164;171;504;9864;3813;484;7,60;57,68;United Kingdom;Western Europe;"Adis International Ltd";"1971-2020";"Pharmacology (medical) (Q1)"
1261;22792;"Industrial Marketing Management";journal;"00198501";2,022;Q1;136;314;465;27989;3787;450;6,86;89,14;United States;Northern America;"Elsevier Inc.";"1971-2020";"Marketing (Q1)"
1262;21100201725;"European Journal of Psychology Applied to Legal Context";journal;"19894007, 18891861";2,021;Q1;21;10;31;607;211;31;8,95;60,70;Spain;Western Europe;"Sociedad Espanola de Psicologia Juridica y Forense";"2009-2020";"Applied Psychology (Q1); Law (Q1)"
